{
  "videoId": "1mngVzlAACA",
  "title": "KITSCHKRIEG feat. BLUMENGARTEN & SHIRIN DAVID - Gut Genug (Lyrics)",
  "artist": "Arcade Music",
  "duration": 189,
  "source": "Zuke-BulkSync",
  "syncedType": "word",
  "rawTtml": "<tt xmlns=\"http:\/\/www.w3.org\/ns\/ttml\" xmlns:ttm=\"http:\/\/www.w3.org\/ns\/ttml#metadata\">\n  <body>\n    <div>\n      <p begin=\"01:14.090\" end=\"01:14.530\">\n        <span begin=\"01:14.090\" end=\"01:14.530\">Uh<\/span>\n      <\/p>\n      <p begin=\"01:14.530\" end=\"01:18.260\">\n        <span begin=\"01:14.530\" end=\"01:14.837\">Steige <\/span>\n        <span begin=\"01:14.837\" end=\"01:15.106\">(Uh) <\/span>\n        <span begin=\"01:15.106\" end=\"01:15.375\">nach <\/span>\n        <span begin=\"01:15.375\" end=\"01:15.624\">dem <\/span>\n        <span begin=\"01:15.624\" end=\"01:16.123\">Heulen <\/span>\n        <span begin=\"01:16.123\" end=\"01:16.372\">aus <\/span>\n        <span begin=\"01:16.372\" end=\"01:16.621\">dem <\/span>\n        <span begin=\"01:16.621\" end=\"01:16.890\">Bett <\/span>\n        <span begin=\"01:16.890\" end=\"01:17.139\">und <\/span>\n        <span begin=\"01:17.139\" end=\"01:17.427\">dreh&apos; <\/span>\n        <span begin=\"01:17.427\" end=\"01:17.734\">mein&apos;n <\/span>\n        <span begin=\"01:17.734\" end=\"01:18.003\">Swag <\/span>\n        <span begin=\"01:18.003\" end=\"01:18.260\">auf<\/span>\n      <\/p>\n      <p begin=\"01:18.260\" end=\"01:18.760\">\n        <span begin=\"01:18.260\" end=\"01:18.760\">Wow<\/span>\n      <\/p>\n      <p begin=\"01:18.760\" end=\"01:22.200\">\n        <span begin=\"01:18.760\" end=\"01:19.001\">Nur <\/span>\n        <span begin=\"01:19.001\" end=\"01:19.261\">weil <\/span>\n        <span begin=\"01:19.261\" end=\"01:19.725\">Babsi <\/span>\n        <span begin=\"01:19.725\" end=\"01:20.450\">unperfekt <\/span>\n        <span begin=\"01:20.450\" end=\"01:20.691\">ist <\/span>\n        <span begin=\"01:20.691\" end=\"01:20.969\">tritt <\/span>\n        <span begin=\"01:20.969\" end=\"01:21.452\">Shirin <\/span>\n        <span begin=\"01:21.452\" end=\"01:21.954\">perfekt <\/span>\n        <span begin=\"01:21.954\" end=\"01:22.200\">auf<\/span>\n      <\/p>\n      <p begin=\"01:22.200\" end=\"01:22.570\">\n        <span begin=\"01:22.200\" end=\"01:22.570\">Yup<\/span>\n      <\/p>\n      <p begin=\"01:22.570\" end=\"01:26.140\">\n        <span begin=\"01:22.570\" end=\"01:23.007\">Darum <\/span>\n        <span begin=\"01:23.007\" end=\"01:23.251\">lass <\/span>\n        <span begin=\"01:23.251\" end=\"01:23.478\">uns <\/span>\n        <span begin=\"01:23.478\" end=\"01:23.967\">streiten <\/span>\n        <span begin=\"01:23.967\" end=\"01:24.176\">an <\/span>\n        <span begin=\"01:24.176\" end=\"01:24.403\">uns <\/span>\n        <span begin=\"01:24.403\" end=\"01:24.892\">zweifeln <\/span>\n        <span begin=\"01:24.892\" end=\"01:25.154\">heute <\/span>\n        <span begin=\"01:25.154\" end=\"01:25.416\">geh&apos;n <\/span>\n        <span begin=\"01:25.416\" end=\"01:25.643\">wir <\/span>\n        <span begin=\"01:25.643\" end=\"01:26.140\">Crashout<\/span>\n      <\/p>\n      <p begin=\"01:26.140\" end=\"01:26.830\">\n        <span begin=\"01:26.140\" end=\"01:26.830\">Crashout<\/span>\n      <\/p>\n      <p begin=\"01:26.830\" end=\"01:28.360\">\n        <span begin=\"01:26.830\" end=\"01:27.043\">Für <\/span>\n        <span begin=\"01:27.043\" end=\"01:27.256\">die <\/span>\n        <span begin=\"01:27.256\" end=\"01:27.700\">meisten <\/span>\n        <span begin=\"01:27.700\" end=\"01:27.913\">bin <\/span>\n        <span begin=\"01:27.913\" end=\"01:28.126\">ich <\/span>\n        <span begin=\"01:28.126\" end=\"01:28.360\">Miss<\/span>\n      <\/p>\n      <p begin=\"01:28.360\" end=\"01:28.830\">\n        <span begin=\"01:28.360\" end=\"01:28.526\">Uh <\/span>\n        <span begin=\"01:28.526\" end=\"01:28.692\">uh <\/span>\n        <span begin=\"01:28.692\" end=\"01:28.830\">uh<\/span>\n      <\/p>\n      <p begin=\"01:28.830\" end=\"01:30.140\">\n        <span begin=\"01:28.830\" end=\"01:29.297\">Bauch <\/span>\n        <span begin=\"01:29.297\" end=\"01:29.764\">beine <\/span>\n        <span begin=\"01:29.764\" end=\"01:30.140\">po<\/span>\n      <\/p>\n      <p begin=\"01:30.140\" end=\"01:33.760\">\n        <span begin=\"01:30.140\" end=\"01:30.438\">Doch <\/span>\n        <span begin=\"01:30.438\" end=\"01:30.714\">mir <\/span>\n        <span begin=\"01:30.714\" end=\"01:31.054\">selbst <\/span>\n        <span begin=\"01:31.054\" end=\"01:31.352\">sag&apos; <\/span>\n        <span begin=\"01:31.352\" end=\"01:31.628\">ich <\/span>\n        <span begin=\"01:31.628\" end=\"01:32.160\">jeden <\/span>\n        <span begin=\"01:32.160\" end=\"01:32.564\">Tag: <\/span>\n        <span begin=\"01:32.564\" end=\"01:32.904\">&quot;Bleib <\/span>\n        <span begin=\"01:32.904\" end=\"01:33.478\">einfach <\/span>\n        <span begin=\"01:33.478\" end=\"01:33.760\">du&quot;<\/span>\n      <\/p>\n      <p begin=\"01:33.760\" end=\"01:37.500\">\n        <span begin=\"01:33.760\" end=\"01:34.461\">Du <\/span>\n        <span begin=\"01:34.461\" end=\"01:35.279\">bist <\/span>\n        <span begin=\"01:35.279\" end=\"01:36.038\">gut <\/span>\n        <span begin=\"01:36.038\" end=\"01:37.500\">genug<\/span>\n      <\/p>\n      <p begin=\"01:37.500\" end=\"01:41.430\">\n        <span begin=\"01:37.500\" end=\"01:38.236\">Du <\/span>\n        <span begin=\"01:38.236\" end=\"01:39.095\">bist <\/span>\n        <span begin=\"01:39.095\" end=\"01:39.893\">gut <\/span>\n        <span begin=\"01:39.893\" end=\"01:41.430\">genug<\/span>\n      <\/p>\n      <p begin=\"01:41.430\" end=\"01:45.330\">\n        <span begin=\"01:41.430\" end=\"01:42.161\">Du <\/span>\n        <span begin=\"01:42.161\" end=\"01:43.014\">bist <\/span>\n        <span begin=\"01:43.014\" end=\"01:43.806\">gut <\/span>\n        <span begin=\"01:43.806\" end=\"01:45.330\">genug<\/span>\n      <\/p>\n      <p begin=\"01:45.330\" end=\"02:36.700\">\n        <span begin=\"01:45.330\" end=\"01:54.961\">Du <\/span>\n        <span begin=\"01:54.961\" end=\"02:06.198\">bist <\/span>\n        <span begin=\"02:06.198\" end=\"02:16.632\">gut <\/span>\n        <span begin=\"02:16.632\" end=\"02:36.700\">genug<\/span>\n      <\/p>\n      <p begin=\"02:36.700\" end=\"02:40.380\">\n        <span begin=\"02:36.700\" end=\"02:37.390\">Du <\/span>\n        <span begin=\"02:37.390\" end=\"02:38.195\">bist <\/span>\n        <span begin=\"02:38.195\" end=\"02:38.942\">gut <\/span>\n        <span begin=\"02:38.942\" end=\"02:40.380\">genug<\/span>\n      <\/p>\n      <p begin=\"02:40.380\" end=\"02:44.380\">\n        <span begin=\"02:40.380\" end=\"02:41.130\">Du <\/span>\n        <span begin=\"02:41.130\" end=\"02:42.005\">bist <\/span>\n        <span begin=\"02:42.005\" end=\"02:42.817\">gut <\/span>\n        <span begin=\"02:42.817\" end=\"02:44.380\">genug<\/span>\n      <\/p>\n      <p begin=\"02:44.380\" end=\"02:48.310\">\n        <span begin=\"02:44.380\" end=\"02:45.116\">Du <\/span>\n        <span begin=\"02:45.116\" end=\"02:45.975\">bist <\/span>\n        <span begin=\"02:45.975\" end=\"02:46.773\">gut <\/span>\n        <span begin=\"02:46.773\" end=\"02:48.310\">genug<\/span>\n      <\/p>\n      <p begin=\"02:48.310\" end=\"02:53.310\">\n        <span begin=\"02:48.310\" end=\"02:49.247\">Du <\/span>\n        <span begin=\"02:49.247\" end=\"02:50.340\">bist <\/span>\n        <span begin=\"02:50.340\" end=\"02:51.355\">gut <\/span>\n        <span begin=\"02:51.355\" end=\"02:53.310\">genug<\/span>\n      <\/p>\n    <\/div>\n  <\/body>\n<\/tt>",
  "lines": [
    {
      "time": 74090,
      "endTime": 74530,
      "text": "Uh",
      "words": [
        {
          "startTime": 74090,
          "endTime": 74530,
          "word": "Uh"
        }
      ]
    },
    {
      "time": 74530,
      "endTime": 78260,
      "text": "Steige (Uh) nach dem Heulen aus dem Bett und dreh' mein'n Swag auf",
      "words": [
        {
          "startTime": 74530,
          "endTime": 74837,
          "word": "Steige "
        },
        {
          "startTime": 74837,
          "endTime": 75106,
          "word": "(Uh) "
        },
        {
          "startTime": 75106,
          "endTime": 75375,
          "word": "nach "
        },
        {
          "startTime": 75375,
          "endTime": 75624,
          "word": "dem "
        },
        {
          "startTime": 75624,
          "endTime": 76123,
          "word": "Heulen "
        },
        {
          "startTime": 76123,
          "endTime": 76372,
          "word": "aus "
        },
        {
          "startTime": 76372,
          "endTime": 76621,
          "word": "dem "
        },
        {
          "startTime": 76621,
          "endTime": 76890,
          "word": "Bett "
        },
        {
          "startTime": 76890,
          "endTime": 77139,
          "word": "und "
        },
        {
          "startTime": 77139,
          "endTime": 77427,
          "word": "dreh' "
        },
        {
          "startTime": 77427,
          "endTime": 77734,
          "word": "mein'n "
        },
        {
          "startTime": 77734,
          "endTime": 78003,
          "word": "Swag "
        },
        {
          "startTime": 78003,
          "endTime": 78260,
          "word": "auf"
        }
      ]
    },
    {
      "time": 78260,
      "endTime": 78760,
      "text": "Wow",
      "words": [
        {
          "startTime": 78260,
          "endTime": 78760,
          "word": "Wow"
        }
      ]
    },
    {
      "time": 78760,
      "endTime": 82200,
      "text": "Nur weil Babsi unperfekt ist tritt Shirin perfekt auf",
      "words": [
        {
          "startTime": 78760,
          "endTime": 79001,
          "word": "Nur "
        },
        {
          "startTime": 79001,
          "endTime": 79261,
          "word": "weil "
        },
        {